{
  "version": 3,
  "cognition": {
    "consumption_per_researcher_per_hour": 1,
    "consumption_per_researcher_per_day": 24,
    "crisis": {
      "max_stacks": 3,
      "calamity_per_impaired_per_day": 10
    }
  },
  "housing": {
    "living_units_per_batch": 2,
    "housing_per_batch": 4,
    "housing_per_researcher": 1
  },
  "housing_linkage": {
    "no_housing_erosion_probability_multiplier": 2.0,
    "no_housing_skip_cure_for_eroded": true
  },
  "info_daily": {
    "per_researcher_base": 3,
    "penalty_no_housing": 1,
    "penalty_cognition_crisis": 1,
    "minimum_if_not_eroded": 1
  },
  "recruitment": {
    "enabled": false,
    "base_batch_size": 20,
    "base_progress_per_day": 1.0,
    "housing_shortage_batch_penalty_per_person": 1,
    "min_batch_size": 1
  }
}
